{ "$schema": "../../../schema/variant.schema.json", "name": "resolve-active-beats-focus-visible", "description": "active still outranks focus-visible (focus slot < active).", "function": "resolve_variant", "input": { "base": "c", "props": { "c.0": "base", "c:focus-visible.0": "fv", "c:active.0": "a" }, "width": 1000, "activeStates": ["focus-visible", "active"] }, "expected": "a" }
