{ "$schema": "../../../schema/variant.schema.json", "name": "resolve-disabled-lowest", "description": "hover outranks disabled.", "function": "resolve_variant", "input": { "base": "backgroundColor", "props": { "backgroundColor.0": "white", "backgroundColor:disabled.0": "lightgray", "backgroundColor:hover.0": "gray" }, "width": 1000, "activeStates": ["disabled", "hover"] }, "expected": "gray" }
