{ "$schema": "../../../schema/variant.schema.json", "name": "resolve-focus-visible-ranks-as-focus", "description": "focus-visible shares the focus slot, so it outranks hover.", "function": "resolve_variant", "input": { "base": "c", "props": { "c.0": "base", "c:hover.0": "h", "c:focus-visible.0": "fv" }, "width": 1000, "activeStates": ["hover", "focus-visible"] }, "expected": "fv" }
