{ "$schema": "../../../schema/variant.schema.json", "name": "parse-combined", "description": "Combined @bp:state in canonical order.", "function": "parse_prop_key", "input": { "key": "backgroundColor@md:hover.0" }, "expected": { "base": "backgroundColor", "breakpoint": "md", "state": "hover", "arg": "0" } }
