{ "$schema": "../../../schema/variant.schema.json", "name": "resolve-hover-inactive", "description": "hover ignored when not active.", "function": "resolve_variant", "input": { "base": "backgroundColor", "props": { "backgroundColor.0": "white", "backgroundColor:hover.0": "gray" }, "width": 1000, "activeStates": [] }, "expected": "white" }
