{ "$schema": "../../../schema/variant.schema.json", "name": "resolve-active-beats-hover", "description": "active outranks hover.", "function": "resolve_variant", "input": { "base": "backgroundColor", "props": { "backgroundColor.0": "white", "backgroundColor:hover.0": "gray", "backgroundColor:active.0": "black" }, "width": 1000, "activeStates": ["hover", "active"] }, "expected": "black" }
